{
  "adapter_input_contract": [
    "exact candidate input manifest and manifest digest",
    "all projected candidate blob bytes and blob digests",
    "exact qualification interface and test-vector digests",
    "measured interpreter binary and committed dependency lock digests"
  ],
  "candidate_projection": "module_group_blob_set/v1",
  "capability_id": "distribution-admission",
  "claim_boundary": "definition_only_no_qualification_verdict",
  "execution_preconditions": [
    "adapter is content-addressed and explicitly bound to this test vector",
    "adapter consumes the exact candidate manifest and every projected blob",
    "interpreter binary and dependency lock identities are evidence-bound",
    "baseline and mutated executions both produce schema-valid evidence"
  ],
  "mutation_probe": {
    "expectation": "at_least_one_observation_or_verdict_changes",
    "no_op_rejected": true,
    "operation": "flip_one_candidate_blob_byte",
    "target": "projected_candidate_blob_bytes"
  },
  "qualification_interface": {
    "digest": "sha256:86db7c8f66ef0d96e17dafa6ab9ca7ee2f2f32350c494c9d91b59140b0bf82d0",
    "media_type": "application/json",
    "relative_path": "pmorg/capabilities/qualification-interfaces/distribution-admission-v1.json",
    "size_bytes": 2201
  },
  "reference_implementation": {
    "digest": "sha256:3de94fd5bf5ce69ab43b7567eed49a253a6b2987399fd6c3cdea3cbb41923342",
    "media_type": "text/x-python",
    "relative_path": "backend/pmorg/application/distribution_admission.py",
    "size_bytes": 40306
  },
  "runtime_identity": {
    "artifacts": [
      {
        "digest": "sha256:02e735b3dfe1c32833eb550b7ff8ffa17f5f2bc3fa1e7bae61a8f5a3883ce398",
        "media_type": "text/plain",
        "relative_path": ".python-version",
        "size_bytes": 5
      },
      {
        "digest": "sha256:0d94ec86320a53e5135fb48e120cfd85ee3964884dd499c8c842b53b13177876",
        "media_type": "application/toml",
        "relative_path": "pyproject.toml",
        "size_bytes": 9983
      },
      {
        "digest": "sha256:47fae521b821b6b917699171779c582f3c722536eeb5b5729cef5525e913c708",
        "media_type": "application/toml",
        "relative_path": "uv.lock",
        "size_bytes": 1018201
      }
    ],
    "contract_digest": "sha256:59ebd918c79614af1a4dec86b52a747e02b2b133ee14a27d30fa498c65e1e7db",
    "interpreter_measurement": "sha256_of_executed_interpreter_binary",
    "status": "binary_measurement_required_at_execution"
  },
  "schema_version": "pmorg.qualification-test-vector/v1",
  "test_cases": [
    {
      "candidate_bytes_required": true,
      "case_id": "valid-controlled-synthetic-destination",
      "expected_observation": "allow only for the exactly bound subset and destination",
      "mutation_required": false,
      "stimulus": "valid signed admission for the exact subset and measured destination"
    },
    {
      "candidate_bytes_required": true,
      "case_id": "missing-or-invalid-admission",
      "expected_observation": "deny before publish or export",
      "mutation_required": false,
      "stimulus": "remove or corrupt the distribution admission envelope"
    },
    {
      "candidate_bytes_required": true,
      "case_id": "post-auth-or-redirect-drift",
      "expected_observation": "deny or abort before any further transfer",
      "mutation_required": false,
      "stimulus": "change destination identity after auth or redirect"
    },
    {
      "candidate_bytes_required": true,
      "case_id": "production-or-unknown-destination",
      "expected_observation": "deny in development_test scope",
      "mutation_required": false,
      "stimulus": "present production or unknown destination scope"
    },
    {
      "candidate_bytes_required": true,
      "case_id": "candidate-byte-influence",
      "expected_observation": "at least one adapter observation or verdict changes",
      "mutation_required": true,
      "stimulus": "flip one byte in a projected candidate blob and rebuild its manifest"
    }
  ],
  "test_id": "A-LIC-003",
  "vector_version": "1.0.0"
}
